{"boundaries":{"api_credentials_published":false,"dedicated_subdirectory":"build-demo/","demo_only":true,"external_runtime_dependency":false,"official_portrayal_claimed":false,"pmtiles_published_by_build06a":false,"private_archive_published":false,"production_runtime_wired":false,"published_file_count":3,"raw_attributes_published":false,"raw_geographic_coordinates_published":false,"source_pdf_published":false},"deployment":{"artifact_root":"artifacts/tmp/public-site","base_public_release_preserved":true,"deployment_performed":false,"live_verification_performed":false,"workflow":".github/workflows/build06a-pages.yml"},"destination":{"expected_live_url":"https://dongpo.github.io/topoMap/build-demo/","provider":"github-pages","public_path":"build-demo/","repository":"dongpo/topoMap"},"files":[{"bytes":737,"path":"data/specifications/nma-build-05-authorization-consumption-v1.0.json","sha256":"715a5445827b77308ec32a67efe74ac8e5ed29b9037ee543285270a4da1c9d47"},{"bytes":6767,"path":"data/specifications/nma-build-05-golden-execution-package-v1.0.json","sha256":"508e3378a698f869255485c5008fdb80ed670ce174a3b72092aab5160df7431c"},{"bytes":14981,"path":"index.html","sha256":"de5f6d567810e42af915bdff167fb21e202967b98817e2ef8d2d494d0b47be2d"}],"predecessor":{"branch":"build/build-06-demo-verification-freeze","commit_sha":"ac8552066f85e07358751b1f15a6fbc085f7fc67","freeze_sha256":"bc636eb1eed7e055306b7271d2cf169c05a4990ab37cebf0b9f89288d53e7857"},"prepared_on":"2026-08-20","publication_id":"build-06a-pages-bc636eb1eed7e055","publication_sha256":"83c22625ad99dbc0cb26af614d39cf6fd12e6e77b1c863b501656e46f6d105a9","publication_version":"build-06a/1.0","schema_version":"nma.build-demo-safe-publication/1.0","status":"bounded-public-demo-ready"}
